Question,Answer 1,#1,Answer 2,#2,Answer 3,#3,Answer 4,#4
Name Something You Do Right Before Your Picture Is Taken,Smile,54,Pose,12,Brush Hair,11,Say Cheese,10
Name Something You Can Buy In A Cordless Version,Telephone,74,Shaver,10,Drill,8,Screwdriver,3
Name A Reason You Would Go To Grandma’s House For Dinner Instead Of A Restaurant.,Home Cooking,41,Holiday,30,Free,22,See Family,6
Name Something The Stars Eat That You Probably Would Not Find In Middle America.,Sushi,40,Caviar,32,Escargot,14,Tofu,12
"Although Some Consider It Paradise, Name A Downside To Living In Hawaii",Volcanoes,35,Rain,31,High Cost Of Living,25,Too Many Tourists,5
Name A Reason A Mailman Might Have A Bad Day On His Route,Attacked By A Dog,52,Bad Weather,39,Traffic,5,Too Much Mail,4
Tell Me Something That Makes Some Bugs More Annoying Than Others,Bite/Sting,42,Buzzing,36,Ability To Fly,12,Traveling In Swarms,7
Name A Reason That A Child Might Get Taken Out For Ice Cream (More Specific Than “Good”).,Good Grades,42,Birthday,26,Good Behavior,20,Upset,8
Name Something Children Might Get Rewarded For,Good Grades,45,Chores,35,Good Behavior,12,Using The Toilet,6
Tell Me A Special Day That You Wish Lasted Longer Than 24 Hours,Christmas,44,Wedding,42,Birthday,7,Valentines Day,5
"When Scuba Diving, Name Something You Have To Wear To Make Yourself More Like A Fish.",Flippers,56,Goggles,20,Oxygen Tank,14,Wetsuit,6
Name A High School Subject Kids Might Take To Get An Easy “A.”,Gym/Health,47,Home Economics,26,Art,11,Wood Shop,10
"Other Than Sitting And Watching, Name Something People Do In Front Of The TV.",Eat,58,Sleep,26,Dance,9,Yell,3
"If You Saw Your Love Interest Unexpectedly, Name A Specific Reason You’d Avoid Them.",Your Shy,34,Your Cheating,26,You Look Bad,23,Your Sick,14
How Many Times Does The Average Person Let A Phone Ring Before Answering It? (Numeric Only),2,57,3,36,5,4,6,2
We Asked 100 Wives: What Percent Of The Housework Does Your Husband Do?,10,41,0,29,25,15,50,11
Name A Cartoon Movie That Features Animals As The Main Characters.,Lion King,43,Finding Nemo,29,Bambi,12,101 Dalmations,8
Name A Letter Of The Alphabet That Is Also A Vitamin?,C,39,E,26,B,18,A,15
Name A Famous Aaron? (Erin?),Hank Aaron,32,Aaron Spelling,32,Erin Brokovich,28,Aaron Burr,3
What Information About A Woman Might A Man Keep In His Little Black Book?,Phone Number,43,Name,32,What Dhe Looks Like,13,Address,7
Tell Me Something About A Couple That Would Lead You To Believe They Spend Too Much Time Together.,Dress Alike,31,Argue,27,Finish Sentences,25,Affectionate,15
"Name Something A Friend Should Never Ask About, No Matter How Well They Know You",Romantic Life,32,Weight,30,Financial Situation,25,Age,12
Name A Place Where You Hate To Get Stuck,Traffic,48,Elevator,34,Work,11,Airport,5
How Might A Snowman Lose Some Of Its Accessories?,Melt,51,Wind,34,Stolen,7,Animals Eat Them,4
"If You Run Into A Bear In The Woods, Name Something You Should Not Do.",Feed It,46,Fight It,27,Pet It,14,Approach It,11
"What Do You Do When Someone Says Hi, But You’re Sure You’ve Never Met Them?",Say Hi Back,49,Just Smile,36,Ignore Them,10,Ask Who They Are,4
Why Might A Person Only Be Allowed A Limited Number Of Phone Calls?,In Jail,51,Too Expensive,30,Grounded,8,At Work,7
Name A Book That Students Keep On Hand For Reference.,Dictionary,56,Encyclopedia,22,Thesaurus,13,Atlas,6
Name A Reason You Might Suspect That Your Roommate Is Turning Into A Vampire.,Grows Fangs,33,Likes Blood,26,Sleep Schedule,22,Avoids Sun,17
Name The Softest Thing In A Baby’s Room.,Blanket,57,Stuffed Animal,17,Pillow,15,Baby’s Skin,7
In Which Profession Would It Be Easiest To Get Away With Wearing Sweat Pants?,Gym Teacher/Coach,51,Personal Trainer,39,Janitor,3,Babysitter,3
"With Regard To Dating, Name Something Moms Warn Their Sons To Avoid",Becoming Intimate,40,Greedy Girl,25,Becoming A Father,24,Bad Girls,6
Name A Food New York Is Famous For.,Hot Dogs,36,Pizza,35,Cheesecake,15,Bagels,8
"Past Or Present, Name A U.S. President Who You Wouldn’t Mind Having A Beer With.",Bill Clinton,44,George W Bush,23,John F Kennedy,17,Barack Oboma,6
"Name Someone, Past Or Present, Who Is Known For Hosting A Children’s Television Program",Mr Rogers,43,Bill Cosby,23,Captain Kangaroo,16,Barney,10
Tell Me Which Of The 7 Dwarfs Would Have The Hardest Time Finding A Date.,Grumpy,44,Sleepy,26,Dopey,15,Bashful,8
Name Something A Dog Owner Might Pay Someone To Do To Their Dog?,Groom It,45,Walk It,38,Feed It,7,Bathe It,6
Name A Place Where Hot Dogs Are Often Served.,Sporting Event,50,Carnival,32,Street Corner,9,Beach,5
Name Something You Try To Prevent From Getting Flat.,Tire,40,Hair,33,Soda,20,Beer,5
Name Something In Your Garage That Might Be Mistaken For A Snake In The Dark.,Garden Hose,56,Rope,19,Electrical Cord,13,Bike Chain,8
Name A Reason Why You Might Use Candles.,Electricity Went Out,80,Romance,6,Lightbulb Burned Out,5,Birthday Cake,5
Name Something You Might Wash Everyday,Hands,28,Hair,25,Face,22,Body,20
Name Something People Catch.,Illness,41,Fish,36,Balls,15,Bouquet,3
Name Something A Person Might Be Told To “Hang Up.”,Phone,51,Jacket/Clothes,29,Bad Job,5,Boxing Gloves,3
"With Eyes Closed, Name Something About A Man’s Mouth That A Woman Kissing Him Could Use To Identify Him.",Facial Hair,44,Size Of Lips,25,Smell,19,Braces/Teeth,10
Name Something A Man Does To Groom Himself,Shave,60,Comb Hair,23,Shower,11,Brush teeth,4
"If A Health-Nut Ordered A Sandwich, What Ingredient Might They Leave Off?",Mayo,40,Cheese,31,Meat,21,Butter,4
Name Something People Do To Their Food That Makes It Unhealthy,Add Salt,46,Fry It,33,Put Sugar On Top,9,Butter It,8
Name Something Some People Jump Out Of,Airplane,49,Bed,26,Boat,12,Cake,9
Name Something Everybody Knows About Turkeys.,Gobble,47,Thanksgiving,25,Tast Good,22,Can’t Fly,3
Name Something You Lie To Your Boss About.,Sick/Absence,52,Lateness,39,Resume/Expeirience,3,Can’t Work Overtime,2
"Name A Coffee Drink People Order While They’re Out, But Can’t Make At Home",Late,62,Esspresso,17,Mocha,10,Cappuccino,10
Name Something That People Today Probably Wash More Than They Need To.,Hair,36,Clothes/Pants,31,Hands,15,Car,13
Name A Type Of Reservation That Often Gets Lost,Hotel,46,Dinner,29,Plane,21,Car Rental,3
Name A Game Teenagers Play At Parties,Spin The Bottle,69,Twister,10,Quarters,8,Cards,8
Name A Complaint People Might Have About Their Teeth,Not White Enough,58,Hurt,17,Crooked,13,Cavity,7
Name Something In Their Home That An Extremely Organized Person Might Alphabetize.,Books,51,Movies,19,Food,16,CDS,12
"If Santa Claus Had To Enter The Witness Protection Program, Name Something He Might Do To Disguise His Appearance.",Shave,53,Lose Weight,24,Dye His Hair,12,Change Clothes,8
Name Someone Specific In A Bank Robber’s Life That he Doesn’t Want To Find Out About His Illegal Activity,Parents,48,Spouse,31,Parole Officer,12,Children,7
Name Something On A Kids’ Playground That Adults Could Use As Exercise Equipment.,Monkey Bars,66,Swing,24,See Saw,6,Chinup Bar,3
What Event Might Someone Attend Without Their Spouse That Would Make You Think They Broke Up?,Wedding,52,Party,32,Reunion,6,Christmas,5
Name Something That Every Family Does Immediately When They Win Family Feud,Scream,52,Jump,25,Hug,12,Clap,7
Tell Me A Place In The Newspaper Where You Wouldn’t Want To See Your Name.,Obituaries,48,Front Page,27,Crime Log/Courts,15,Classified,9
Name Something Women Talk About During A “Girls’ Night Out.”,Dating/Relationships,63,Kids,14,Work,11,Clothes,9
Name Something That Causes A Person To Laugh.,Jokes,39,Being Tickled,33,TV Show/Movie,13,Clown,11
Name A Breed Of Dog That Would Never Scare Away A Burglar.,Chihauhua,45,Poodle,41,Dashound,8,Cocker Spanial,6
Name A Responsibility That Most Married Couples Share,Finances,43,House Chores,26,Childcare,22,Cooking,5
"If You Could Have Just One Chore That Someone Else Would Always Do For You, What Would It Be? (More Specific Than “Clean.”)",Wash Dishes,49,Laundry,27,Clean Toilet,14,Cooking,6
Name A Halloween Costume That Is A Complete Misrepresentation Of The Occupation It Portrays.,Nurse,61,Doctor,16,Housekeeper,13,Cop,8
Name Something People Wore More Of In The 1800s Than They Do Today,Hats/Bonnets,45,Dresses/Hoop Skirts,25,Wigs,16,Corsets,12
Name The Best Kind Of Music To Dance To With Someone You Want To Be Close To,Slow,36,Waltz,33,Jazz,20,Country,7
What Signs Of Being A “Bad Boy” Might A Woman Be Attracted To?,Tattoos,41,Motorcycle,28,Rebelious Outfit,24,Criminal Record,3
"Even Though It’s A Beautiful Place To Visit, Name A Reason Why You Might Not Want To Live In Hawaii",Far Away,41,Rains Too Much,21,Expensive,16,Crowded,16
Name Something That May Include A Meal In The Ticket Price.,Concert,42,Flight,28,Movie,15,Cruise,12
"If A Groom Was Extremely Nervous About Getting Married, What Might He Do At The Alter?",Faint,46,Sweat,32,Run,14,Cry,4
Name Something You Do When Your Computer Freezes Up.,Re Boot,49,Walk Away,29,Yell,11,Curse,6
"Past Or Present, Name A Famous Magician",Harry Houdini,60,David Copperfield,17,Merlin,14,David Blane,7
Which Endearment Would Many Women Be Annoyed To Hear A Stranger Call Them By?,Honey,50,Baby,29,Sweetie,10,Dear,10
"If Dog Owners Demanded Fido Get A Job, What Job Might He Be Good At?",Guarding/Security,58,Digging Holes,20,Track People/Police,11,Deliver Papers,6
Name A Piece Of Information That You Write Down When You’re On Your Way To Meet Your Blind Date.,Address/Location,40,Dates Name,32,Phone Number,14,Description Of Date,8
Name Something From School That A Kid Might Try To Hide From Their Parents.,Report Card/Grades,50,Note From Teacher,21,Homework,17,Detention/Discipline,9
Name Something You Never Leave Unlocked. (More Specific Than “Door”.),Car,36,Safe,30,House,27,Diary,5
Name A Topic That People Might Whisper About.,Their Love Lives,46,Infidelity,35,Rumor,7,Divorce,6
Name A Person Or Character Who Is Referred To As “Lady.”,Lady Gaga,33,Royalty/Princess Diana,30,First Lady,20,Dog/Lady And The Tramp,16
Name Something People Go To A Professional To Have Cleaned.,Teeth,59,Clothes,29,Carpet,9,Drapes,2
"Name Something A Game Show Host Has To Do, Even On A Day When He Doesn’t Feel Like It.",Put On A Happy Face,44,Make Conversation,37,Go To Work,15,Dress Up,3
Tell Me Something That Americans Want To Do While Visiting France.,Eat French Cuisine,58,Shop,18,See Eiffel Tower,18,Drink Wine,4
Name Something A Driver Might Do That Would Cause You To Write Down His Car’s License Number.,Hit And Run,24,Cut In Front,20,Drunk Driving,16,Drive Recklessly,6
"What Might A Chef Do While Cooking, That Would Ruin The Whole Dish?",Burn It,45,Sneeze,32,Too Much Salt,11,Drop It,8
Name A Game You Need Dice To Play.,Monopoly,45,Yatzee,34,Craps,14,Dungeos & Dragons,5
Name Something It’s Probably Much Harder To Do In Outer Space Than It Is On Earth.,Breathe,37,Walk,34,Go To The Bathroom,16,Eat,13
"If You Were Dating A Real Knight In Shining Armor, Name Something You’d Have Difficulty Doing Together.",Kissing/Snuggling,47,Walking,19,Dancing,14,Eating,14
Name An Actor Who Uses Or Used Their Middle Initial.,Michael J Fox,66,Samuel L Jackson,13,George C Scott,11,Edward G Robinson,9
Name Something That Can Be Stuffed.,Turkey,45,Animals,41,Pillows,5,Eggs,4
Name Something People Try To Squeeze Into (More Specific Than “Clothes”).,Jeans,40,Gown,27,Car,22,Elevator,7
Which Part Of A Newspaper Would A Teenager Likely Read First?,Comics,51,Sports,38,Horoscope,4,Entertainment,3
Name A Big Event That Happens To TV Characters In Order To Up Ratings.,Death,44,Wedding,36,New Baby,10,Fall In Love,6
Name A Day Of The Year When Most People Call Home.,Christmas,65,Mother’s Day,22,Thanksgiving,8,Family Birthday,3
Name Something People Know More About If They Read The Tabloids In The Checkout Line.,Celebs/ScandlesCelebs/Scandals,73,Aliens,13,Diets,8,Fashion,4
What Would You Have To Learn To Do Before Starring In A John Wayne Movie?,Ride A Horse,56,Shoot,17,Act,13,Fight,11
Name Something Our Ancient Ancestors Might Have Danced To Celebrate.,Rain,37,Wedding,31,Birth,20,Finding Food,7
Name The Hardest Position To Play On A Baseball Team,Pitcher,41,Catcher,39,Shortstop,12,First Base,8
Tell Me Something You Might Find In A Bankrobber’s Suitcase.,Money,57,Weapon,34,Mask,6,Flashlight,3
Name Something You Would Be Surprised To Find In A Bachelor’s Bathroom,Feminine Products,46,Make Up,26,Perfume,14,Flowers,9
Name Something That People Normally Don’t Pay Cash For.,Car,53,Gas,20,House,20,Food,5
Name A Body Part That Often Gets Broken,Arm,47,Leg,28,Finger,17,Foot,4
"Besides Math, Name The Most Difficult Subject In School",Science,48,English,27,History,18,Foreign Language,3
Name Something You Do To Prepare For Out-Of-Town Visitors.,Clean,56,Cook,28,Buy Food,12,Freshen Up Room,3
Tell Me The First Big Item You Buy When Moving To A New House.,Bed,32,Couch,30,TV,26,Fridge,8
Name Something That Has Pineapple In It.,Upside Down Cake,60,Pizza,15,Drink,12,Fruit Salad,8
Name Something Bad That Might Happen TO A Magician’s Assistant During A Performance.,Cut In Half,46,Disappear,25,Trip,14,Get Hit By A Knife,13
Name An Event That Men Are Usually Not Invited To,Baby Showers,54,Bridal Showers,32,Bachelorette Party,7,Girls Sleepover,2
Name A Dessert That Can Only Be Eaten With A Spoon.Name Something A Man Might Still Do For Woman When They Go Out On A Date,Open Doors,76,Pay For Dinner,14,Compliment Her,4,Give Her Flowers,2
Name Something People Often Lose,Keys,47,Money,39,Minds,6,Glove,3
Name A Color Baby Clothes Comes in.,Pink,50,Blue,37,Yellow,11,Green,2
"Name A Breakfast Item That You Order, But Can Never Finish",Pancakes,51,Omelet,36,Coffee,6,Grits,4
What Do You Do When Someone Tells A Joke That’s Not Actually Funny?,Smile,45,Fake Laugh,42,Ignore It,7,Groan,4
"At The End Of The Day, Name Something Indiana Jones Might Put Away In His Closet.",Hat,42,Whip,38,Knife,9,Gun,8
Name A Part Of A Doll’s Body That Might Be Movable,Head,47,Arms,28,Legs,13,Hand,7
Name Something That’s More Likely To Happen To You If You’re Hanging Out At A Bar.,Get Drunk,52,Get In A Fight,32,Get Hit On,6,Have A Cigarette,5
How Can You Tell The Jewelry Your Partner Gives You Is Made Of Fake Gold?,Turns Skin Green,56,Bite It/Bendable,30,Scratches Easily,8,Have It Appraised,3
"What Might You Want To Bring With You, When Babysitting An Infant Who Cries A Lot?",Pacifier,38,Ear Plugs,36,Toys,19,Headphones,6
Name The Worst Thing To Criticize Your Mother-In-Law For,Her Cooking,37,Her Parenting,38,Her Appearance,25,Her Housekeeping,9
Name Something You Do While Birdwatching That You Might Also Do While Hunting,Shoot(Picture),44,Use Binoculars,32,Be Quiet,25,Hide,7
Name An Activity For Which You Might Use Walkie Talkies.,Camping,46,Hiking,37,Hunting,25,Hide And Seek,10
"If Einstein Failed A Subject In School, What Might It Have Been?",English/Language,41,Physical Ed,34,Art,13,History,9
Name A Sport That You Can’t Play Without A Team,Football,39,Baseball,31,Soccer,17,Hockey,9
Name Another Word For A “Bar” That A Cowboy Might Use,Saloon,51,Tavern,47,Watering Hole,13,Honky Tonk,5
Tell Me An Excuse That A Tough Guy Might Give If He Were Caught Watching A Soap Opera,By Mistake,32,For Wife,31,Asleep,25,Hot Actress,8
What Kind Of Food Should Not Be Served At A Wedding?,Pizza,44,Hamburgers,21,Sanswiches,16,Hot Dogs,15
Name An Occupation You’d Be Tempted To Enter If You Liked To Snoop,Espionage,34,Police,26,News Reporter,22,Housekeeping,10
Name A Book Where The Main Hero Is A Kid.,Harry Potter,76,Peter Pan,10,Tom Sawyer,9,Huck Finn,3
Name An Announcement That You’d Hate For Your Boss To Overhear You Making,I’m Quitting,43,I’m Pregnant,29,I Got A New Job,23,I Hate This Job/Boss,11
Name Something Specific A Rental Car Company Checks When You Return Your Car.,Mileage,38,Gas,34,If There Is Damage,15,If It is Clean,12
Name Something Embarrassing That You Might Do While Listening To Headphones.,Sing,52,Speak Loudly,22,Dance,13,Ignore Someone,8
"If You Were Able To See The Future, Name A Way That You’d Be Able To Make A Lot Of Money.",Lottery Numbers,52,Betting/Horse Races,20,Investment,18,Invention,9
Name Something About Alaska That Non-Residents Might Romanticize,Snow/Cold,54,Wildlife,18,Darkness,16,Isolation/Nature,9
Name Something A Carjacker Would Hate To Discover About The Car He Stole,Out Of Gas,42,It’s A Police Car,22,Fas GPS,19,It Doesn’t Run,13
Name Something You Might Find An Olive In.,Martini,67,Salad,18,Pizza,10,Jar,3
Tell Me A Game Show That’s Been Around Forever.,Price Is Right,59,Family Fued,14,Wheel Of Fortune,14,Jeopardy,9
We Asked 100 Husbands: Name Something Your Wife Spends More Money On Than You Do.,Clothes,58,Hair Products,27,Make Up,7,Jewelry,4
Name A Kind Of beam You Wouldn’t Want To Balance On.,Light/Sun Beam,44,Laser Beam,28,Roof Beam,20,Jim Beam,3
Name An Athlete Who’s Appeared On A Wheaties Box.,Tiger Woods,44,Michael Jordan,38,Mary Lou Retton,12,Joe Montana,5
"Past Or Present, Name A TV Judge.",Judge Judy,63,Judge Mathis,20,Judge Wapner,7,Judge Joe Brown,6
Name Something People Are Often Trying To Get Out Of Doing.,Work,38,Homework,35,Chores,14,Jury Duty,13
Name Something Parents Should Do To Be Sure That Their Kids Have A Safe Halloween.,Go With Them,47,Check Candy,28,Bright Costume,16,Keep Home,7
Name An Organ In The Body That Many People Should Take Better Care Of,Heart,37,Liver,26,Lungs,23,Kidney,13
Name Something That People Could Watch For Hours.,TV/Movies,66,Pets/Animals,12,Sports,12,Kids,8
Name A City Associated With Organized Crime,New York,53,Chicago,34,Los Angeles,7,Las Vegas,5
Name A Popular Flavor Of Sherbet.,Orange,76,Lime,12,Strawberry,7,Lemon,5
Name Something You Started Seeing Less Of Since Cell Phones Became Popular,Pay Phones,36,Home Phones,26,Pagers,23,Letters,11
Tell Me Something You Might Buy For The Prom,Dress/Tux,59,Corsage,29,Shoes,7,Limo,3
"Name Someone, Real Or Fictional, Whose Name Starts With Little",Little Richard,30,Little John,25,Little Red Riding Hood,24,Little Bo Peep,19
Name Something A Cat In A Movie Can Do That A Real-Life Cat Can’,Talk,58,Sing,21,Dance,7,Live Nine Lives,5
Name A Famous Pirate,Jack Sparrow,44,Captain Hook,33,Blackbeard,19,Long John Silver,3
Name Something People Do More Of When They’re Tired,Sleep,50,Yawn,25,Eat,9,Lose Temper,5
Name Something You Tell Someone Is Going To Hurt You More Than Them.,Spanking,46,Breaking Up,28,Shot,14,Loss Of Privileges,9
Tell Me Something A Dog Can’t Stand.,Cats,61,Getting A Bath,18,Vacuum Cleaner,5,Mail Carrier,5
Name A Skill That Parents Hope Their Children Have By The Time They Buy A Home.,Good With Money,45,Cooking,26,Cleaning,14,Maintainance,11
Name Something That Dogs Are Always Able To Do That People Can Only Do On A Camping Trip.,Pee Outside,50,Sleep Anywhere,28,Catch Food,12,Make Lots Of Noise,8
"In Today’s World, Name Something That Helps People Stay “Forever Young.”",Plastic Surgery,39,Exercise,35,Vitamins,10,Makeup,6
Name A Famous Person Whose Last Name Is Allen,Woody Allen,34,Tim Allen,30,Debbie Allen,23,Marcus Allen,8
Name A Place Where You Need An Appointment.,Doctor,63,Dentist,22,Hair Salon,8,Mechanic,3
Name Something You Would Not Want To Buy At A Dollar Store.,Food,45,Clothes,37,Birth Control,11,Medicine,5
Tell Me A Nickname For A Woman Named “Margaret.”,Marge/Margie,36,Maggie,31,Peggy/Peg,17,Meg,13
Name A Cartoon Character That Can Fly,Dumbo,47,Tinkerbell,24,Peter Pan,19,Mighty Mouse,8
Name A Place Where You Might See A Bear.,Woods,48,Zoo,32,National Park,14,Mountains,5
Name Something You Might See Pictured On A Postcard From Alaska.,Snow,42,Iceberg,31,Polor Bear,14,Mountains,9
What Must A Town Have To Make It A Popular Winter Destination?,Snow,44,Skiing,32,Resorts,13,Mountains,7
"If You Were Staying Overnight At A Friend’s And Forgot Your Toothbrush, Name Something You Might Do.",Use My Finger,59,Buy A New One,19,Ask For An Extra,9,Mouthwash,9
Name Something A Parent Might Scold A Child For Interrupting,Conversation,59,Date,18,Work/Meeting,11,Movie/TV Show,10
Name A Specific Chore Kids Do In Order To Get An Allowance.,Wash Dishes,44,Take Out Trash,26,Clean Room,15,Mow Lawn,10
Name A Party Game That You’d Be Surprised To Find At An Adult’s Birthday.,Pin The Tail,54,Twister,20,Spin The Bottle,13,Musical Chairs,9
We Asked 100 Women To Fill In The Blank: I’d Notice Right Away If _____ Was Missing From My Purse.,Money,52,Make Up,34,My Cell Phone,6,My Keys,4
"When Meeting A Blind Date, Name An Accessory You Might Wear So They Know It’s You.",Hat,35,Jewelry,28,Flower,24,Nametag,10
Name A Place In The World Where People Might Go To Get Married,Las Vegas,61,Hawaii,19,Paris,16,Niagra Falls,3
How Could You Tell That Someone’s ID Is Fake?,Photo Doesn’t Match,57,Made Up Name,28,Expired Date,10,No Seal,3
Name A Complaint A Person Might Have About Their Cable TV Company.,Bad Reception,38,Cost To Much,30,Bad Service,15,Not Enough Channels,12
Name A Term That Describes Someone Who Comes In At First Place,Winner,85,Champion,5,Early Bird,3,Number 1,2
Name Something You Associate With Jerry Lewis.,Telethon,58,Comedy,17,Dean Martin,13,Nutty Proffesor,8
"When Shopping, Name A Way You Can Tell If Someone Is A Sales Clerk",Name Tag,59,Wears Uniform,32,Follows You,3,Offers Help,3
Name Something You Might Do To Keep Your House Cool On A Hot Day,Air Conditioning,73,Turn On The Fan,13,Close Blinds,9,Open Windows,5
Name A Celebrity Who You’d Like To Be BFFs With Just So You Could Get The Scoop On Her Personal Life.,Angelina Jolie,45,Jennifer Aniston,23,Kim Kardashian,12,Oprah,6
Name A Fruit Juice That’s Very Bitter.,Grapefruit,37,Lemon,32,Cranberry,19,Orange,10
"If James Bond Were A Real Man, Name Something That Probably Would Have Happened To Him By Now.",He’d Be Dead,70,Gotten Old,15,Gotten Injured,6,Out Of Work,5
Name Something You’d Love To Wake Up To The Smell Of. (More Specific Than “Food.”),Coffee,41,Bacon,34,Flowers,17,Pancakes,6
"In The Office, Name Something That People Borrow But Almost Never Return?",Pen/Pencil,51,Money,26,Stapler,10,Paper,6
We Asked 100 Wives: Name Something Specific You Wish Your Husband Would Be More Helpful With Around The House,Dishes,42,Laundry,31,Cooking,14,Parenting,11
Name A Reason Why You Wouldn’t Want Metallica As Your Wedding Band,Too Loud,52,Not Romantic,34,Too Expensive,5,Parents Disapprove,5
Name A Reason Why A Teen Might Swear Off Love.,Broken Heart,52,Too Young,30,Scared Of It,11,Parents Foebid It,6
Name The Most Romantic Place To Go On A First Date.,Beach,46,Restaurant,32,Movie Theatre,15,Park/Picnic,5
Name A Family Tradition People Might Have For Winter Holidays.,Cooking,40,Travel,36,Caroling,16,Party,6
Name Something Your Husband Would Like To Get Rid Of.,Ball & Chain,43,Extra Pounds,28,Debt,13,Pets,11
Name Something A Grown Child May Leave In Storage At His Parents’ House,Old Clothes,35,Toys,33,Funiture,22,Photos,5
Name Something That You Shouldn’t Have To Do On Your Birthday.,Work,45,Clean,35,Cook,12,Play,3
Name Something You’d Need In Order To Play A Game Of Basketball,Basketball,59,Hoop,25,Court,5,Players,4
"If Someone Turned You Upside Down, Name Something That Would Fall Out Of Your Pockets.",Car Keys,54,Wallet,33,Pen,5,Pocket Knife,3
Name Something You Might Find Out About A City That Would Make You Change Your Plans To Visit.,Crime Rate,47,Weather Forcast,26,Natural Disaster,15,Political Conflict,7
Name Something People Cover When It Rains,Head,28,Car,17,Outdoor Furniture,7,Pool,3
"Other Than Nice Houses, Name A Sign That You’re In A Well-To-Do Neighborhood.",Nice Cars,46,Manicured Lawns,27,Clean streets,17,Pools,10
Give Me Another Name That Kids Use For “Father”,Dad,51,Daddy,28,Papa,10,Pop,8
Name Something People Imagine They’d See On Every Street In Hollywood,Celebrities,57,Bright Lights,16,Palm Trees,15,Prints On Sidewalk,8
Name A Reason A Person Might Prefer To Walk On A Treadmill Instead Of Taking A Walk Outside.,Weather,62,Safer,17,Watch TV,11,Privacy,8
"If You Can’t Find Your Eye Glasses, Where Should You Look?",On Your Head,41,Table/Night Stand,22,In The Car,19,Purse,13
"Name Something You Do For Your Child, And Your Child Does For Her Imaginary Friend.",Feed,65,Talk,13,Play With,13,Read,4
Name Something A Parent Might Do To Help Their Baby Fall Asleep.,Sing Lullaby,53,Rock Them,32,Feed Them,9,Read To them,4
Name A Subject In School That Would Have Helped Santa Do His Job?,Math,44,Geography,25,Wood Shop,24,Reading/Spelling,5
Name Something That Happens To People When They’re Experiencing An Allergic Reaction.,Hives,38,Sneezing,31,Swelling,22,Red Eyes,6
Name A Red Colored Frozen Yogurt Topping.,Strawberry,48,Cherry,37,Raspberry,9,Red Sprinkles,3
"At A Restaurant, What Do You Do If Your Meal Doesn’t Taste Very Good.",Send Back/New Dish,40,Complain,24,Just Eat It,16,Refuse To Pay/Refund,8
"If You Wanted To Have Conversation With Someone, Name A Noisy Place You’d Avoid.",Bar,61,Concert,16,Mall,14,Restaurant,4
Name An Event Many People Don’t Like To Attend Without A Date,Wedding,49,Prom,28,Party,16,Reunion,3
Tell Me A Reason You’d Hate To Run Into Your Boss At The Beach.,Called In Sick,47,Skimpy Suit,28,You’re Drinking,14,Ruin A Good Time,9
"Without Seeing Them Steal, Name Something That You’d See A Person Do To Make You Suspicious That They’re Shoplifting.",Looking Around,59,Big Coat,25,Hands In Pocket,9,Run,3
What Kind Of Athlete Would Have An Unfair Advantage In A Roller Derby?,Ice/Speed Skater,49,Football Player,20,Hockey Player,20,Runner,8
Name Something Teens Think They Understand Long Before They Really Do.,Love,52,Life,23,Money,11,Safe driving,3
What Happens To Your Body That Lets You Know You’re Getting Old?,Werinkles,54,Aches,20,Gray Hair,14,Sagd,8
